362,Set FEC Error Engine,port.layer1.pcs.fec_error_inject.engine.set_all_engines(),
363,Get FEC Error Engine,port.layer1.pcs.fec_error_inject.engine.get(),
364,Get FEC Error Statistics,port.layer1.pcs.fec_error_inject.statistics.get(),
365,Clear FEC Error Statistics,port.layer1.pcs.fec_error_inject.clear_stats.set(),
366,Set Auto-Negotiation Settings,port.layer1.anlt.an.settings.set(),
367,Get Auto-Negotiation Settings,port.layer1.anlt.an.settings.get(),
368,Get Auto-Negotiation Status,port.layer1.anlt.an.status.get(),
369,Set Link Training Settings,port.layer1.anlt.lt.settings.set(),
370,Get Link Training Settings,port.layer1.anlt.lt.settings.get(),
371,Get Link Training Status,port.layer1.serdes[0].lt_status.get(),
372,Set ANLT Auto-Restart,port.layer1.anlt.set_autorestart(...),
373,Get ANLT Auto-Restart,port.layer1.anlt.get_autorestart(),
374,Set ANLT Strict Mode,port.layer1.anlt.set_strict_mode(enable=False),
375,Get ANLT Strict Mode,port.layer1.anlt.get_strict_mode(),
376,Set Auto-Negotiation Allow Loopback,port.layer1.anlt.an.set_allow_loopback(allow=True),
377,Get Auto-Negotiation Allow Loopback,port.layer1.anlt.an.get_allow_loopback(),
378,Set Auto-Negotiation Empty NP,port.layer1.anlt.an.set_empty_np(enable=True),
379,Get Auto-Negotiation Empty NP,port.layer1.anlt.an.get_empty_np(),
380,Get Auto-Negotiation Supported Abilities,port.layer1.anlt.an.abilities.get(),
381,Set Auto-Negotiation Advertise,port.layer1.anlt.an.advertise.set(),
382,Get Auto-Negotiation Advertise,port.layer1.anlt.an.advertise.get(),
383,Set Link Training Algorithm,port.layer1.serdes[0].lt.set_algorithm_default(),
384,Get Link Training Algorithm,port.layer1.serdes[0].lt.get_algorithm(),
385,Set Link Training Modulation NRZ,port.layer1.serdes[0].lt.set_initial_modulation_nrz(),
386,Set Link Training Modulation PAM4,port.layer1.serdes[0].lt.set_initial_modulation_pam4(),
387,Set Link Training Modulation PAM4Precoding,port.layer1.serdes[0].lt.set_initial_modulation_pam4precoding(),
388,Get Link Training Modulation,port.layer1.serdes[0].lt.get_initial_modulation(),
389,Set Preset Native,port.layer1.serdes[0].lt.preset1.native.set(),Using the native values for Preset 1
390,Get Preset Native,port.layer1.serdes[0].lt.preset1.native.get(),Using the native values for Preset 1
391,Set Preset IEEE,port.layer1.serdes[0].lt.preset1.ieee.set(),Using the IEEE values for Preset 1
392,Get Preset IEEE,port.layer1.serdes[0].lt.preset1.ieee.get(),Using the IEEE values for Preset 1
393,Set Preset Level,port.layer1.serdes[0].lt.preset1.level.set(),Using the level values for Preset 1
394,Get Preset Level,port.layer1.serdes[0].lt.preset1.level.get(),Using the level values for Preset 1
395,Reset Preset to Default,port.layer1.serdes[0].lt.preset1.reset.set(),
396,Set EQ Range Native,port.layer1.serdes[0].lt.range.main.native.set(),"Using native values, set the response when reaches the min or max"
397,Get EQ Range Native,port.layer1.serdes[0].lt.range.main.native.get(),"Using native values, set the response when reaches the min or max"
398,Set EQ Range IEEE,port.layer1.serdes[0].lt.range.main.ieee.set(),"Using ieee values, set the response when reaches the min or max"
399,Get EQ Range IEEE,port.layer1.serdes[0].lt.range.main.ieee.get(),"Using ieee values, set the response when reaches the min or max"
400,Set EQ Range Auto Native,port.layer1.serdes[0].lt.range.main.native.set(),"When in Auto mode, the min and max values use the default values ignored"
401,Set EQ Range Auto IEEE,port.layer1.serdes[0].lt.range.main.ieee.set(),"When in Auto mode, the min and max values use the default values ignored"
402,Set Link Training Config,port.layer1.anlt.lt_config.set(),Using IEEE standard OOS preset
403,Set Link Training Config,port.layer1.anlt.lt_config.set(),Using IEEE standard OOS preset
404,Control ANLT AN Only,port.layer1.anlt.ctrl.enable_an_only(),Only enable Auto-Negotiation
405,Control ANLT AN & LT Auto,port.layer1.anlt.ctrl.enable_an_lt_auto(),Enable Auto-Negotiation and Link Training (auto mode)
406,Control ANLT AN & LT Interactive,port.layer1.anlt.ctrl.enable_an_lt_interactive(),Enable Auto-Negotiation and Link Training (manual mode)
407,Control ANLT LT Auto Only,port.layer1.anlt.ctrl.enable_lt_auto_only(),"Only enable Link Training (auto mode), skipping Auto-Negotiation"
408,Control ANLT LT Interactive Only,port.layer1.anlt.ctrl.enable_lt_interactive_only(),"Only enable Link Training (manual mode), skipping Auto-Negotiation"
409,Control ANLT Disable,port.layer1.anlt.ctrl.disable_anlt(),Disable both Auto-Negotiation and Link Training
410,Send Link Training Modulation,port.layer1.serdes[0].lt.send_cmd_modulation(),Send PAM4 Request
411,Send Link Training Modulation,port.layer1.serdes[0].lt.send_cmd_modulation(),Send PAM4Precoding Request
412,Send Link Training Preset,port.layer1.serdes[0].lt.send_cmd_preset(),Send Preset Request
413,Send Link Training Inc,port.layer1.serdes[0].lt.send_cmd_inc(),Send EQ Coefficient Inc Request
414,Send Link Training Dec,port.layer1.serdes[0].lt.send_cmd_dec(),Send EQ Coefficient Dec Request
415,Send Link Training No Equalization,port.layer1.serdes[0].lt.send_cmd_no_equalization(),Send No EQ
416,Send Link Training Trained,port.layer1.serdes[0].lt.send_cmd_trained(),Send Trained Notification
417,Get Link Training Command Result,port.layer1.serdes[0].lt.get_cmd_result_flag(),Check response status after sending any command
418,Get Auto-Negotiation Results,port.layer1.anlt.an.results.get(),Get Auto-Negotiation results
419,Get Auto-Negotiation Statistics,port.layer1.anlt.an.statistics.get(),Get Auto-Negotiation statistics
420,Get Link Training Results,port.layer1.serdes[0].lt.results.get(),"Get Link Training results, per-serdes"
421,Get Link Training Statistics,port.layer1.serdes[0].lt.statistics.get(),"Get Link Training statistics, per-serdes"
422,Set Signal Integrity Sample Control,port.layer1.serdes[0].siv.control.set(),
423,Get Signal Integrity Sample Data,port.layer1.serdes[0].siv.data.get(),
424,Set TX Equalizer,port.layer1.serdes[0].medium.tx_equalizer.set(),Tx Equalizer Settings
425,Set RX Equalizer,port.layer1.serdes[0].medium.rx_equalizer.set(),Rx Equalizer Settings
426,Set TX Equalizer,port.layer1.serdes[0].medium.tx_equalizer.set(),Tx Equalizer Settings
427,Set RX Equalizer,port.layer1.serdes[0].medium.rx_equalizer.set(),Rx Equalizer Settings
428,Set TX Native,port.layer1.serdes[0].medium.tx.native.set(),Tx Equalizer Settings
429,Set RX AGC,port.layer1.serdes[0].medium.rx.config.agc.set(),"Rx Equalizer Settings, either in Auto, Manual, or Freeze"
430,Set RX CDR,port.layer1.serdes[0].medium.rx.config.cdr.set(),"Rx Equalizer Settings, either in Auto, Manual, or Freeze"
431,Set RX CTLE High,port.layer1.serdes[0].medium.rx.config.ctle_high.set(),"Rx Equalizer Settings, either in Auto, Manual, or Freeze"
432,Set RX CTLE Low,port.layer1.serdes[0].medium.rx.config.ctle_low.set(),"Rx Equalizer Settings, either in Auto, Manual, or Freeze"
433,Set RX DFE,port.layer1.serdes[0].medium.rx.config.dfe.set(),"Rx Equalizer Settings, either in Auto, Manual, or Freeze"
434,Set RX OC,port.layer1.serdes[0].medium.rx.config.oc.set(),"Rx Equalizer Settings, either in Auto, Manual, or Freeze"
435,Set RX Post-FFE 1,port.layer1.serdes[0].medium.rx.config.post_ffe_1.set(),Post-FFE 1-23
436,Set RX Pre-FFE 1,port.layer1.serdes[0].medium.rx.config.pre_ffe_1.set(),Pre-FFE 1-8
437,Set TX IEEE,port.layer1.serdes[0].medium.tx.ieee.set(),Tx Equalizer Settings
438,Transceiver Read/Write,port.transceiver.access_rw(...).set(),Provides read and write access to the
439,Transceiver Read/Write,port.transceiver.access_rw(...).get(),Provides read and write access to the
440,Transceiver Sequential Read/Write,port.transceiver.access_rw_seq(...).set(),I2C sequential access to a transceiver's register.
441,Transceiver Sequential Read/Write,port.transceiver.access_rw_seq(...).get(),I2C sequential access to a transceiver's register.
442,Transceiver Sequential Read/Write Banked,port.transceiver.access_rw_seq_bank(...).set(),I2C sequential access with bank selection.
443,Transceiver Sequential Read/Write Banked,port.transceiver.access_rw_seq_bank(...).get(),I2C sequential access with bank selection.
444,Transceiver MII Access,port.transceiver.access_mii(...).set(),Provides access to the register interface supported.
445,Transceiver MII Access,port.transceiver.access_mii(...).get(),Provides access to the register interface supported.
446,Configure I2C,port.transceiver.i2c_config.set(),Configures the I2C interface parameters
447,Get TX Laser Power,port.transceiver.laser_power.tx_laser_power.get(),Reading of the optical power level of the Tx/Rx signal
448,Get RX Laser Power,port.transceiver.laser_power.rx_laser_power.get(),Reading of the optical power level of the Tx/Rx signal
449,Get CDB Instances Supported,port.transceiver.cmis.cdb_instances_supported.get(),Return the supported CDB instances from the CMIS transceiver